question,answer,contexts,ground_truth
Какую итоговую сумму задолженности суд взыскал с Росимущества по делу № 2-1730/2024 и почему она меньше заявленной истцом?,"По делу № 2-1730/2024, суд взыскал с Росимущества сумму задолженности в размере 11 076,12 рублей за счет наследственного имущества.

Сумма меньше заявленной истцом по нескольким причинам:

1. Суд применил принцип наследственного правопреемства, согласно которому обязательства по возврату долга переходят к наследникам в пределах стоимости наследственного имущества.

2. В решении указано, что взыскание производится именно в пределах стоимости наследственного имущества, которая составляет 24 500 рублей. Суд ограничился именно этой суммой.

3. Возможно, истец мог заявлять большую сумму, но суд ограничился меньшей суммой, которая была возможна в рамках наследственного имущества.

Таким образом, суд взыскал с Росимущества 11 076,12 рублей из-за применения принципа наследственного правопреемства и ограничения взыскания в пределах стоимости наследственного имущества.","['В связи с чем, суд считает, что заявленные требования банков подлежат частичному удовлетворению и принимая признание иска ответчиком ФИО2 на сумму 24 500 рублей, взысканию с надлежащего ответчика ФИО2 в пределах стоимости наследственного имущества (24 500 рублей) в пользу АО «ТБанк» подлежит задолженность по кредитному договору - 3 510 рублей 95 копеек, в пользу ПАО Сбербанк подлежит задолженность по кредитному договору - 20 989 рублей 05 копеек, которая рассчитана судом исходя из пропорции общей суммы заявленных требований банков (170 967 рублей 46 копеек принятых как 100% к сумме конкретного требования каждого банка (АО « Т Банк » - 41 962 рубля 58 копеек и ПАО Сбербанк 129 004 рубля 88 копеек) к стоимости наследственного имущества 24 500 рублей в пределах которого удовлетворяются требования кредиторов).\nВ остальной части исков, в том числе к ответчикам МТУ Росимущества по Республике Коми, ФИО1 надлежит отказать.', 'Руководствуясь ст.ст.194-199 ГПК РФ, суд\nРЕШИЛ:\nИсковые требования удовлетворить частично.\nВзыскать солидарно с ФИО2, ДД.ММ.ГГГГ года рождения (ИНН №), ФИО3, ДД.ММ.ГГГГ года рождения, (ИНН №), ФИО4, ДД.ММ.ГГГГ года рождения, (ИНН №) в пользу ООО ПКО «Агентство по урегулированию споров» (ИНН №) задолженность по кредитному договору № от ДД.ММ.ГГГГ в размере 4725,14 рублей в порядке наследования после смерти ФИО1, ДД.ММ.ГГГГ года рождения, умершей ДД.ММ.ГГГГ, также солидарно взыскать расходы по уплате государственной пошлины в размере 4000 рублей. Всего взыскать 8725 (восемь тысяч семьсот двадцать пять) рублей 14 копеек.\nВ остальной части исковых требований отказать.\nВ удовлетворении исковых требований к Российской Федерации в лице Межрегионального территориального управления Росимущества в <адрес> – Югре, <адрес> отказать.', 'Решение № 2-1730/2024 2-238/2025 2-238/2025(2-1730/2024;)~М-1528/2024 М-1528/2024 от 23 июня 2025 г. по делу № 2-1730/2024\nПартизанский городской суд (Приморский край) - Гражданское\nМотивированное\nрешение\nизготовлено 24 июня 2025 года\nДело № 2-238/2025\nУИД: 25RS0013-01-2024-002252-14\nРЕШЕНИЕ\nИменем Российской Федерации\n<Дата><адрес>\nПартизанский городской суд <адрес> в составе:\nпредседательствующего судьи Шкляр О.В.,\nпри секретаре судебного заседания ФИО3,\nрассмотрев в открытом судебном заседании гражданское дело по исковому заявлению ООО ПКО «Агентство по урегулированию споров» к Федеральному агентству по управлению государственным имуществом в <адрес> о взыскании задолженности по договору кредитной карты за счет наследственного имущества,\nУ С Т А Н О В И Л:', 'Таким образом, к ответчику, принявшему наследство, перешло обязательство по возврату долга в порядке универсального правопреемства. Спорные правоотношения допускают правопреемство, которое состоялось, поэтому обязанность по возврату долга и уплате процентов за пользование денежными средствами перешло к ответчику в порядке наследования по закону.\nДоговора страхования в связи с заключением кредитного договора заемщиком не заключалось.\nРазрешая исковые требования, суд приходит к выводу об их частичном удовлетворении путем взыскания с Территориального управления Росимущества в Калининградской области задолженности по договору в пределах стоимости наследственного имущества в размере 11 076,12 руб. за счет денежных находящихся на счете № <данные изъяты> открытом в ПАО Сбербанк.\nПо общему правилу, предусмотренному ч. 1 ст. 98 ГПК РФ, стороне, в пользу которой состоялось решение суда, суд присуждает возместить с другой стороны все понесенные по делу судебные расходы.', 'На основании изложенного, руководствуясь ст.ст. 194-198,233-237 ГПК РФ, суд\nРЕШИЛ:\nИсковые требования АО ""ТБанк"" к ФИО1 о взыскании долга по кредитному договору, удовлетворить.\nВзыскать с ФИО1 (№) в пользу АО «ТБанк» (ИНН <***>) просроченную задолженность, образовавшуюся за период с 27.08.2024 по 16.02.2025 включительно, в размере 1 523 281,63 руб. и государственную пошлину в размере 30 233 руб.\nРезолютивная часть решения оглашена 23 июня 2025 года, мотивированное решение в окончательной форме составлено 07 июля 2025 года.\nОтветчик вправе подать в суд, принявший заочное решение, заявление об отмене этого решения суда в течение семи дней со дня вручения ему копии этого решения.', 'В соответствии со ст. 57 Гражданского процессуального кодекса Российской Федерации доказательства представляются сторонами и другими лицами, участвующими в деле.\nПредставленный истцом расчет соответствует условиям кредитного договора, в то время как ответчиком не представлено доказательств отсутствия задолженности по кредиту.\nОтветчик расчет задолженности не оспорил, собственный расчет не представил, доказательств оплаты заявленной истцом суммы исковых требований по задолженности по кредитному договору не представил.\nПоскольку судом установлено ненадлежащее исполнение заемщиком обязательств по кредитному договору, с учетом приведенных истцом обстоятельств, подтвержденных надлежащими доказательствами, суд считает требование истца о взыскании задолженности по кредитному договору обоснованным и подлежащим удовлетворению.\nТаким образом, с ответчика в пользу истца подлежит взысканию задолженность по кредитному договору в сумме ...', 'Решение может быть обжаловано в апелляционном порядке в <адрес>вой суд через Партизанский городской суд <адрес> в течение месяца со дня его принятия в окончательной форме.\nСудья О.В. Шкляр\nСуд:\nПартизанский городской суд (Приморский край) (подробнее)\nИстцы:\nООО ПКО ""Агентство по урегулированию споров"" (подробнее)\nОтветчики:\nТерриториальное управление Федерального агентства по управлению Государственным имуществом в Приморском крае (подробнее)\nСудьи дела:\nШкляр Олеся Владимировна (судья) (подробнее)\nПоследние документы по делу:\nРешение от 23 июня 2025 г. по делу № 2-1730/2024\nРешение от 8 октября 2024 г. по делу № 2-1730/2024\nРешение от 12 февраля 2024 г. по делу № 2-1730/2024\nПоказать все документы по этому делу\nСудебная практика по:\nПо кредитам, по кредитным договорам, банки, банковский договор\nСудебная практика по применению норм ст. 819, 820, 821, 822, 823 ГК РФ']","Суд взыскал 1285 рублей 16 копеек. Сумма ограничена стоимостью наследственного имущества (выморочного имущества), найденного на счетах умершего ФИО1."
"Какую общую сумму (включая основной долг, моральный вред и штраф) суд взыскал с ООО «Эдэкс» в пользу ФИО1 по делу № 2-823/2025?","Суд взыскал с ООО «Эдэкс» в пользу ФИО1 следующую сумму по делу № 2-823/2025:

1. Денежные средства в размере 98 560,00 рублей.
2. Денежную компенсацию морального вреда в размере 5 000,00 рублей.
3. Штраф в размере 62 269,59 рублей.

Общая сумма составляет:
98 560,00 + 5 000,00 + 62 269,59 = 165 829,59 рублей.","['Решение № 2-823/2025 2-823/2025~М-688/2025 М-688/2025 от 22 июня 2025 г. по делу № 2-823/2025\nВерхнеуслонский районный суд (Республика Татарстан ) - Гражданское\nУИД: 16RS0012-01-2025-000908-72\nДело № 2-823/2025\nЗАОЧНОЕ\nРЕШЕНИЕ\nименем Российской Федерации\nсело Верхний Услон 16 июня 2025 года\nРеспублики Татарстан\nВерхнеуслонский районный суд Республики Татарстан в составе:\nпредседательствующего судьи Тюфтиной О.М.,\nпри секретаре судебного заседания Мардегалимовой А.Ф.,\nрассмотрев в открытом судебном заседании гражданское дело по исковому заявлению ФИО1 к ООО «Эдэкс» о взыскании денежных средств,\nу с т а н о в и л:\nФИО1 обратилась в суд с иском к ООО «Эдэкс» о взыскании денежных средств, в обосновании указав, что ДД.ММ.ГГГГ между ней и ООО ""Эдэкс"" был заключен договор оказания услуг, предметом которого выступают платные образовательные услуги. Во исполнение обязательств по договору истцом была оплачена сумма в размере 133 560,00 рублей, взятая ею по кредитному договору в АО «ТБанк».', 'решил:\nИсковые требования ФИО1 к ООО ""ЭдЭкс"" о взыскании денежных средств, процентов, компенсации морального вреда и штрафа, судебных издержек - удовлетворить частично.\nВзыскать с ООО «Эдэкс» (ИНН №) в пользу ФИО1 (паспорт №) денежные средства в размере 105 560.00 рублей, проценты за пользование чужими денежными средствами, начисленные по ст. 395 ГК РФ, за период с ДД.ММ.ГГГГ по ДД.ММ.ГГГГ в размере 4 797,92 руб., компенсацию морального вреда в размере 3000 руб., штрафа в размере 56 678,96 руб., расходы за услуги представителя в размере 7 500 руб., а также расходы по уплате государственной пошлины в размере 4 241,50 руб.\nВзыскать с ООО «Эдэкс» (ИНН №) в пользу ФИО1 (паспорт №) проценты за пользование чужими денежными средствами, начисленные по ст. 395 Гражданского процессуального кодекса Российской Федерации, на сумму долга в размере 105 560.00 руб., начиная с ДД.ММ.ГГГГ по день фактического исполнения обязательства.\nВ остальном, исковые требования оставить без удовлетворения.', 'Признать договор оказания услуг, заключенный 14.11.2024 года между ФИО1 и Обществом с ограниченной ответственностью «ЭДЭКС», расторгнутым с 03.02.2025 года.\nВзыскать с Общества с ограниченной ответственностью «ЭДЭКС» (ИНН: №) в пользу ФИО1 (паспорт <данные изъяты>) денежные средства в размере 33915 рублей, моральный вред в размере 20000 рублей, неустойку за период с 14.02.2025 г. по 28.02.2025 года в размере 47844 руб. 30 коп., проценты за пользование чужими денежными средствами за период с 01.03.2025 г. по день вынесения решения суда, исходя из ключевой ставки Банка России в размере 1853 руб. 71 коп., штраф в размере 51806,50 руб., судебные расходы на юридические услуги в размере 5775 руб., а всего 161194 (сто шестьдесят одна тысяча сто девяносто четыре) рубля 51 копейка.', 'решил:\nИсковые требования удовлетворить.\nВзыскать с ООО «Эдэкс» (ИНН №) в пользу ФИО1 (паспорт №) денежные средства в размере 98 560,00 рублей, денежную компенсацию морального вреда в размере 5 000,00 рублей, штраф в размере 62 269,59 рублей.\nВзыскать с ООО «Эдэкс» (ИНН №) в доход Верхнеуслонского муниципального района Республики Татарстан государственную пошлину в размере 4 736,00 рублей.\nОтветчик вправе подать в Верхнеуслонский районный суд Республики Татарстан заявление об отмене этого решения суда в течение семи дней со дня вручения ему копии этого решения.\nОтветчиком заочное решение суда может быть обжаловано в апелляционном порядке в Верховный Суд Республики Татарстан в течение одного месяца со дня вынесения определения суда об отказе в удовлетворении заявления об отмене этого решения суда.', 'ФИО1 обращаясь в суд с иском о защите прав потребителей, освобожден, в соответствие с пп. 4 п. 2 ст. 333.36 НК РФ, от оплаты государственной пошлины, в связи с чем на основании ст. 103 ГПК РФ в доход местного бюджета следует взыскать государственную пошлину с ООО ""ЭДЭКС"" в размере 6 620 руб.\nНа основании изложенного и руководствуясь ст. ст. 194 - 198, 233 - 235 Гражданского процессуального Кодекса Российской Федерации, суд\nрешил:\nИсковые требования ФИО1 к ООО ""ЭдЭкс"" о взыскании денежных средств, в связи с отказом от договора оказания услуг удовлетворить частично.\nВзыскать с ООО «Эдэкс» (ИНН №) в пользу ФИО1 (паспорт №) денежные средства в размере 121 888,70 рублей, компенсацию морального вреда в размере 3000 руб., штраф в размере 62 444,35 руб.\nВзыскать с ООО «Эдэкс» (ИНН №) в доход Верхнеуслонского муниципального района Республики Татарстан государственную пошлину в размере 6 620 руб.', 'УСТАНОВИЛ:\nФИО1 обратился в суд с иском к Обществу с ограниченной ответственностью «ЭДЭКС» (далее по тексту –ООО «ЭДЭКС», в котором просит расторгнуть договор оказания услуг от ДД.ММ.ГГГГ, взыскать с ответчика денежные средства в размере 198599,88 рублей –сумму оплаты по договору вместе с процентами, указанными в тарифном плане по кредитному договору, включая 142 018,50 рублей, 3600 рублей –сумма пуш-смс, 16 560 рублей –расходы на досрочное погашение кредита, 10 000 рублей –компенсация морального вреда, а также обязать ответчика возместить проценты по кредиту, начисленные в период неисполнения обязательств в соответствии со ст. 395 ГК РФ.', 'Характер физических и нравственных страданий оценивается судом с учетом фактических обстоятельств, при которых был причинен моральный вред, и индивидуальных особенностей потерпевшего.\nПо настоящему делу судом установлен факт нарушения прав ФИО1 как потребителя вследствие несвоевременного возврата денежных средств, оплаченных по договору об оказании платных образовательных услуг от <дата> между ФИО1 и ООО «ЭДЭКС», заключенному путем акцепта оферты, размещенной на сайте <данные изъяты>\nИстцом заявлено требование о взыскании компенсации морального вреда в размере 3 000 рублей. Учитывая фактические обстоятельства, установленные в ходе судебного разбирательства, суд считает возможным, с учетом требований разумности и справедливости, взыскать с ответчика в пользу истца в счет компенсации причиненного ему морального вреда 3 000 руб.']","Суд взыскал с ООО «Эдэкс» в пользу ФИО1 общую сумму 165 829,59 рублей. Эта сумма складывается из: основного долга — 98 560 рублей, компенсации морального вреда — 5 000 рублей и штрафа — 62 269,59 рублей."
Признал ли суд незаконным постановление о взыскании исполнительского сбора с ФИО1 по делу № 2а-1406/2025 и какая основная причина такого решения?,"По делу № 2А-1406/2025, суд не признал незаконным постановление о взыскании исполнительского сбора с ФИО1. Основная причина такого решения заключается в следующих факторах:

1. Должник не погасил задолженность в установленный срок, поэтому постановление о взыскании исполнительского сбора было законным.

2. У административного истца было достаточно времени для добровольного исполнения требований исполнительного документа, но он этого не сделал.

3. Исполнительное производство было возбуждено раньше, а постановление о взыскании исполнительского сбора вынесено спустя длительный период времени, что свидетельствует о возможности добровольного исполнения.

Таким образом, суд пришел к выводу, что действия административного ответчика (вынесение постановления о взыскании исполнительского сбора) были законными, так как должник не исполнил свои обязательства в добровольном порядке.","['Дело № 2а-1406/2025\n64RS0043-01-2025-001142-19\nРешение\nИменем Российской Федерации\n25 июня 2025 года город Саратов\nВолжский районный суд города Саратова в составе:\nпредседательствующего Магазенко Ю.Ф.,\nпри ведении протокола судебного заседания секретарем Вдовиной В.С.,\nрассмотрев в открытом судебном заседании административное дело по административному исковому заявлению ФИО1 к Волжскому РОСП г. Саратова ГУ ФССП России по Саратовской области, судебному приставу-исполнителю Волжского РОСП г. Саратова ГУ ФССП России по Саратовской области ФИО2, ГУ ФССП России по Саратовской области, заинтересованные лица: МИФНС № 20 по Саратовской области, судебный пристав-исполнитель Волжского РОСП г. Саратова ГУ ФССП России по Саратовской области ФИО3, начальник отделения старший судебный пристав Волжского РОСП г. Саратова ГУ ФССП России по Саратовской области ФИО4, АО « Т Банк » о признании незаконным постановления, возложении обязанности,\nустановил:', 'Таким образом, оснований для признания постановления о взыскании исполнительского сбора незаконным суд не усматривает, поскольку в добровольном порядке требования исполнительного документа должником исполнены не были, постановление вынесено должностным лицом структурного подразделения ФССП России в пределах его полномочий, доказательств своевременного сообщения административным истцом судебному приставу-исполнителю сведений об открытом конкурсном производстве не представлено.\nНа дату рассмотрения настоящего административного искового заявления постановление о взыскании исполнительского сбора от 19.10.2024г. отменено, в связи с окончанием 20.12.2024г. исполнительного производства № от ДД.ММ.ГГГГ по основаниям п. 7 ч. 1 ст. 47 ФЗ ""Об исполнительном производстве"", что свидетельствует о том, что данное постановление перестало нарушать права и законные интересы административного истца, в связи с чем, оснований для разрешения вопроса об его отмене суд не усматривает.', 'Учитывая приведенные нормы права и установленные по делу обстоятельства, суд приходит к выводу об отсутствии оснований для удовлетворения административных исковых требований административного истца о признании незаконными действия административного ответчика о вынесении постановления о взыскании исполнительского сбора по исполнительному производству имущественного характера от 19.02.2025 № 64040/25/6100759, поскольку задолженность по исполнительному производству не погашена в установленный постановлением для добровольного исполнения срок, соответственно постановление о взыскании исполнительского сбора, является законным.\nПри этом, суд обращает внимание на то, что исполнительное производство возбуждено ДД.ММ.ГГГГ, а постановление о взыскании исполнительского сбора вынесено спустя длительный период времени только ДД.ММ.ГГГГ, соответственно, у административного истца имелось достаточно времени для исполнения требований исполнительного документа в добровольном порядке.', 'УСТАНОВИЛ:\nАдминистративный истец ФИО3 обратилась в суд с вышеуказанным иском к административным ответчикам с требованиями:\n- признать незаконным и отменить постановление судебного пристава-исполнителя ОСП по <адрес> и <адрес> ГУ ФССП России по <адрес> ФИО1 от 19.10.2024г. о взыскании исполнительского сбора по исполнительному производству имущественного характера в отношении должника – ФИО3.\nВ обоснование административного иска ФИО3 указала, что судебный пристав-исполнитель ФИО1 вынесла постановление от 19.10.2024г. о взыскании исполнительского сбора по исполнительному производству имущественного характера о взыскании с должника ФИО3 исполнительского сбора в размере 7 % от суммы долга, что составило 13 049,86 руб.', 'Такие обстоятельства по делу не установлены.\nПоскольку на день рассмотрения административного иска право административного истца восстановлено, исполнительное производство окончено, все ограничения и меры принудительного взыскания отменены, в том числе постановление о взыскании исполнительского сбора, незаконного действия либо бездействия со стороны судебного пристава-исполнителя не установлено, суд приходит к выводу об отказе в удовлетворении заявленных требований в полном объеме.\nНа основании изложенного, руководствуясь ст. ст. 175-180 КАС РФ, суд\nРЕШИЛ:\nВ удовлетворении административного иска ФИО3 к судебному приставу-исполнителю ОСП по <адрес> и <адрес> ГУ ФССП России по <адрес> ФИО1, ГУФССП России по <адрес>, ОСП по <адрес> и <адрес> ГУ ФССП России по <адрес> о признании незаконным и отмене постановления о взыскании исполнительского сбора от 19.10.2024г. – отказать.', 'Ссылаясь на указанные обстоятельства административный истец просит признать незаконными действия административного ответчика о вынесении постановления о взыскании исполнительского сбора по исполнительному производству имущественного характера от ДД.ММ.ГГГГ №. Возложить на административного ответчика обязанность устранить нарушения прав, свобод и законных интересов административного истца путем закрытия сводного исполнительного производства № от ДД.ММ.ГГГГ№-СД.\nЛица, участвующие в деле, в судебное заседание не явились, о времени и месте рассмотрения дела извещены надлежащим образом, о причинах неявки суду не сообщили, об отложении рассмотрения дела не ходатайствовали.\nС учетом положений ст. 150 Кодекса административного судопроизводства Российской Федерации (далее по тексту - КАС РФ), суд определил рассмотреть дело в отсутствие неявившихся лиц, надлежащим образом извещенных о времени и месте судебного заседания.', 'Решение № 2А-2756/2025 2А-2756/2025~М-11371/2024 А-2756/2025 М-11371/2024 от 1 июня 2025 г. по делу № 2А-2756/2025\nБалашихинский городской суд (Московская область) - Административное\nДело №а-2756/2025\n50RS0№-59\nРЕШЕНИЕ\nСУДА\nИменем Российской Федерации\n23 апреля 2025 г. <адрес>\nБалашихинский городской суд <адрес> в составе:\nпредседательствующего судьи Загребиной С.В.,\nпри секретаре ФИО4,\nс участием представителя истца ФИО3 по доверенности ФИО5,\nрассмотрев в открытом судебном заседании административное дело по иску ФИО3 к судебному приставу-исполнителю ОСП по <адрес> и <адрес> ГУ ФССП России по <адрес> ФИО1, ОСП по <адрес> и <адрес> ГУ ФССП России по <адрес>, ГУФССП России по <адрес> об оспаривании постановления о взыскании исполнительского сбора,\nУСТАНОВИЛ:\nАдминистративный истец ФИО3 обратилась в суд с вышеуказанным иском к административным ответчикам с требованиями:']","Нет, суд отказал в удовлетворении иска и признал постановление законным. Причина: задолженность не была погашена в установленный для добровольного исполнения срок, а списание средств в АО 'Т-Банк' произошло уже после возбуждения исполнительного производства."
Какую итоговую сумму (основной долг + моральный вред + штраф) суд взыскал с ООО «ЭдЭкс» в пользу Соболевского по делу № 2-782/2025 и как учитывались ранее выплаченные ответчиком 15 760 рублей?,"По делу № 2-782/2025 суд взыскал с ООО «ЭдЭкс» следующую сумму:

1. Денежные средства: 121 888,70 рублей
2. Компенсация морального вреда: 3 000 рублей
3. Штраф: 62 444,35 рублей

Общая сумма составляет: 121 888,70 + 3 000 + 62 444,35 = 187 333,05 рублей.

В решении указано, что взыскание государственной пошлины с ООО «ЭдЭкс» не производится, так как истец освобожден от уплаты государственной пошлины в соответствии с п. 3 ст. 17 Закона РФ ""О защите прав потребителей"" и п. 4 ч. 2 ст. 333.36 НК РФ.

Однако в решении не упоминается сумма ранее выплаченных ответчиком 15 760 рублей. Без дополнительной информации о том, как эта сумма была учтена в деле, невозможно точно сказать, как она была учтена или уменьшила итоговую сумму взыскания. Если эти средства были учтены как часть задолженности, то общая сумма взыскания могла быть меньше указанной выше.","['ФИО4 обращаясь в суд с иском о защите прав потребителей, освобожден, в соответствие с пп. 4 п. 2 ст. 333.36 НК РФ, от оплаты государственной пошлины, в связи с чем на основании ст. 103 ГПК РФ в доход местного бюджета следует взыскать государственную пошлину с ООО ""ЭДЭКС"" в размере 6620 руб.\nНа основании изложенного и руководствуясь ст. ст. 194 - 198, 233 - 235 Гражданского процессуального Кодекса Российской Федерации, суд\nрешил:\nИсковые требования Соболевского ФИО2 к ООО ""ЭдЭкс"" о взыскании денежных средств, в связи с отказом от договора оказания услуг удовлетворить частично.\nВзыскать с ООО «Эдэкс» (ИНН №) в пользу Соболевского ФИО3 (паспорт <данные изъяты>) денежные средства в размере 121 888,70 рублей, компенсацию морального вреда в размере 3000 руб., штраф в размере 62 444,35 руб.\nВзыскать с ООО «Эдэкс» (ИНН № в доход Верхнеуслонского муниципального района Республики Татарстан государственную пошлину в размере 6 620 руб.', 'решил:\nИсковые требования ФИО1 к ООО ""ЭдЭкс"" о взыскании денежных средств, процентов, компенсации морального вреда и штрафа, судебных издержек - удовлетворить частично.\nВзыскать с ООО «Эдэкс» (ИНН №) в пользу ФИО1 (паспорт №) денежные средства в размере 105 560.00 рублей, проценты за пользование чужими денежными средствами, начисленные по ст. 395 ГК РФ, за период с ДД.ММ.ГГГГ по ДД.ММ.ГГГГ в размере 4 797,92 руб., компенсацию морального вреда в размере 3000 руб., штрафа в размере 56 678,96 руб., расходы за услуги представителя в размере 7 500 руб., а также расходы по уплате государственной пошлины в размере 4 241,50 руб.\nВзыскать с ООО «Эдэкс» (ИНН №) в пользу ФИО1 (паспорт №) проценты за пользование чужими денежными средствами, начисленные по ст. 395 Гражданского процессуального кодекса Российской Федерации, на сумму долга в размере 105 560.00 руб., начиная с ДД.ММ.ГГГГ по день фактического исполнения обязательства.\nВ остальном, исковые требования оставить без удовлетворения.', 'Факт нарушения ответчиком ООО ""ЭДЭКС"" прав истца как потребителя нашел подтверждение в ходе рассмотрения дела, в добровольном досудебном порядке требования истца удовлетворены ответчиком не были, в связи с чем, суд приходит к выводу о взыскании с него в пользу истца штрафа.\nРазмер подлежащего взысканию с ответчика ООО ""ЭДЭКС"" в пользу истца штрафа составит 56 678,96 руб. (105 560 руб. + 4 797,92+3000 руб.) x 50%.\nОснований для снижения суммы штрафа суд не находит.\nНа основании п. 3 ст. 17 Закона РФ ""О защите прав потребителей"", п. 4 ч. 2 ст. 333.36 НК РФ потребители по искам, связанным с нарушением их прав, освобождаются от уплаты государственной пошлины.', 'Факт нарушения ответчиком ООО ""ЭДЭКС"" прав истца как потребителя нашел подтверждение в ходе рассмотрения дела, в добровольном досудебном порядке требования истца удовлетворены ответчиком не были, в связи с чем, суд приходит к выводу о взыскании с него в пользу истца штрафа.\nРазмер подлежащего взысканию с ответчика ООО ""ЭДЭКС"" в пользу истца штрафа составит 68 427,84 руб. (121 888,70 руб. + 11 986,99 руб.+ 3000 руб.) x 50%.\nОснований для снижения суммы штрафа суд не находит.\nНа основании п. 3 ст. 17 Закона РФ ""О защите прав потребителей"", п. 4 ч. 2 ст. 333.36 НК РФ потребители по искам, связанным с нарушением их прав, освобождаются от уплаты государственной пошлины.', 'Факт нарушения ответчиком ООО ""ЭДЭКС"" прав истца как потребителя нашел подтверждение в ходе рассмотрения дела, в добровольном досудебном порядке требования истца удовлетворены ответчиком не были, в связи с чем, суд приходит к выводу о взыскании с него в пользу истца штрафа.\nРазмер подлежащего взысканию с ответчика ООО ""ЭДЭКС"" в пользу истца штрафа составит 62 444,35 руб. (121 888 руб. + 3000 руб.) x 50%.\nОснований для снижения суммы штрафа суд не находит.\nНа основании п. 3 ст. 17 Закона РФ ""О защите прав потребителей"", п. 4 ч. 2 ст. 333.36 НК РФ потребители по искам, связанным с нарушением их прав, освобождаются от уплаты государственной пошлины.', 'Факт нарушения ответчиком ООО ""ЭДЭКС"" прав истца как потребителя нашел подтверждение в ходе рассмотрения дела, в добровольном досудебном порядке требования истца удовлетворены ответчиком не были, в связи с чем, суд приходит к выводу о взыскании с него в пользу истца штрафа.\nРазмер подлежащего взысканию с ответчика ООО ""ЭДЭКС"" в пользу истца штрафа составит 62 444,35 руб. (121 888,70 руб. + 3000 руб.) x 50%.\nОснований для снижения суммы штрафа суд не находит.\nНа основании п. 3 ст. 17 Закона РФ ""О защите прав потребителей"", п. 4 ч. 2 ст. 333.36 НК РФ потребители по искам, связанным с нарушением их прав, освобождаются от уплаты государственной пошлины.', 'Признать договор оказания услуг, заключенный 14.11.2024 года между ФИО1 и Обществом с ограниченной ответственностью «ЭДЭКС», расторгнутым с 03.02.2025 года.\nВзыскать с Общества с ограниченной ответственностью «ЭДЭКС» (ИНН: №) в пользу ФИО1 (паспорт <данные изъяты>) денежные средства в размере 33915 рублей, моральный вред в размере 20000 рублей, неустойку за период с 14.02.2025 г. по 28.02.2025 года в размере 47844 руб. 30 коп., проценты за пользование чужими денежными средствами за период с 01.03.2025 г. по день вынесения решения суда, исходя из ключевой ставки Банка России в размере 1853 руб. 71 коп., штраф в размере 51806,50 руб., судебные расходы на юридические услуги в размере 5775 руб., а всего 161194 (сто шестьдесят одна тысяча сто девяносто четыре) рубля 51 копейка.']","Суд взыскал общую сумму 187 333,05 рублей (121 888,70 руб. долга, 3 000 руб. морального вреда и 62 444,35 руб. штрафа). Ранее выплаченные ответчиком 15 760 рублей (два платежа по 7 880 руб.) были вычтены из первоначальной суммы договора 137 648,70 руб. при расчете задолженности"
